{  
  "$schema":"http://json-schema.org/draft-04/schema#",
  "type":"array",
  "items":{  
    "type":"object",
    "id":"HolidayAgreement",
    "properties":{  
      "employeeId":{  
        "type":"string"
      },
      "id":{  
        "type":"string"
      },
      "createdOn":{  
        "type":"array",
        "items":{  
          "type":"integer"
        }
      },
      "modifiedOn":{  
        "type":"array",
        "items":{  
          "type":"integer"
        }
      },
      "dayOfAbsenceLimits":{  
        "type":"array",
        "items":{  
          "type":"object",
          "id":"DayOfAbsenceLimit",
          "properties":{  
            "typeOfAbsence":{  
              "type":"string"
            },
            "maximumCount":{  
              "type":"integer"
            }
          }
        },
        "required":[  
          "typeOfAbsence",
          "maximumCount"
        ]
      },
      "createdBy":{  
        "type":"string"
      },
      "modifiedBy":{  
        "type":"string"
      },
      "validFrom":{  
        "type":"array",
        "items":{  
          "type":"integer"
        }
      },
      "validUntil":{  
        "type":"array",
        "items":{  
          "type":"integer"
        }
      },
      "agreedOn":{  
        "type":"array",
        "items":{  
          "type":"integer"
        }
      },
      "agreedBy":{  
        "type":"string"
      }
    },
    "required":[  
      "agreedBy",
      "validUntil",
      "employeeId",
      "validFrom",
      "agreedOn"
    ]
  }
}